<!ELEMENT users (user+)>
<!ELEMENT user (userid,name,password)>
<!ELEMENT userid (#PCDATA)>
<!ELEMENT password (#PCDATA)>
<!ELEMENT name (#PCDATA)>